{
  "schemaVersion": "4.5.0",
  "asOf": "2026-10-16",
  "classification": "NONBINDING RESEARCH SCREEN: NO AUTOMATED LEGAL CLEARANCE, FINANCIAL TRANSFER, ACTOR INTENT ATTRIBUTION OR INSTITUTIONAL ENDORSEMENT.",
  "interpretationRules": [
    "Legal compatibility source flags identify questions, not permission or prohibitions in a specific transaction.",
    "One jurisdiction or general licence cannot override additional applicable legal regimes or funder terms.",
    "Potential/unverified funding relationships must never be elevated to confirmed war financing.",
    "Legitimate assistance to Ukrainian defense is distinct from financing Russia’s aggression.",
    "Humanitarian duties are not reciprocal bargaining chips; protected-person information must not be shared.",
    "Do not infer the legal or commercial effect of a restriction without accurate entity, goods, route, asset, and date facts.",
    "Post-agreement proposals are not executable as current projects.",
    "External legal directories and financial-program pages require online re-verification before relying on them."
  ],
  "statuses": [
    {
      "id": "research-only-unassessed",
      "label": "Requires independent counsel and authority review"
    }
  ],
  "links": [
    {
      "id": "bridge-rus-budget-reparations-ledger",
      "fundingProfileId": "rus-budget",
      "regenerativeAlternativeId": "reparations-ledger",
      "compatibilityMechanismId": "restricted-joint-investment",
      "jurisdictionIds": [
        "ru",
        "ua",
        "eu",
        "us",
        "gb"
      ],
      "cooperationMode": "post-agreement",
      "assessment": "research-only-unassessed",
      "premise": "Possible Russian-controlled or sanctioned-counterparty nexus; review separately and do not interpret this option as a consented offer.",
      "legalNexus": "Possible jurisdictions to screen, not a factual finding that their laws all apply. Other countries or instrument-specific frameworks may apply.",
      "requiredChecks": [
        "Identify actual parties, entities, payment routes, goods, locations, and currency before attributing a legal nexus.",
        "Distinguish published funding activity from any future proposal, acceptance, aid diversion, or legal permission.",
        "Independently screen designated persons, ownership/control, export restrictions and relevant current licences.",
        "Obtain Ukrainian and other competent authority approvals where required; avoid granting one body another's powers.",
        "No adverse finding against individual persons, intentional financing allegation, or assumption of Russian/DPRK/Iranian participation is made by this research link.",
        "This stage cannot be implemented without a new independently authorized and verified agreement or legal resolution; no sanctions relief or shared finance is implied.",
        "Registration of damage claims, lawful extraordinary yields, immobilised principal, reparations judgments and disbursement authority must be analyzed as separate concepts."
      ],
      "stopCondition": "STOP if transaction authorization, legal ownership, sanctions status, counterparty consent, financing source or civilian safeguards are unresolved; do not execute.",
      "reviewOwner": "Qualified independent counsel and the competent institutional/government authority",
      "asOf": "2026-10-16"
    },
    {
      "id": "bridge-rus-budget-armistice-verified-incentive",
      "fundingProfileId": "rus-budget",
      "regenerativeAlternativeId": "armistice-verified-incentive",
      "compatibilityMechanismId": "sanctions-relief",
      "jurisdictionIds": [
        "ru",
        "ua",
        "eu",
        "us",
        "gb"
      ],
      "cooperationMode": "reciprocal-conditional",
      "assessment": "research-only-unassessed",
      "premise": "Possible Russian-controlled or sanctioned-counterparty nexus; review separately and do not interpret this option as a consented offer.",
      "legalNexus": "Possible jurisdictions to screen, not a factual finding that their laws all apply. Other countries or instrument-specific frameworks may apply.",
      "requiredChecks": [
        "Identify actual parties, entities, payment routes, goods, locations, and currency before attributing a legal nexus.",
        "Distinguish published funding activity from any future proposal, acceptance, aid diversion, or legal permission.",
        "Independently screen designated persons, ownership/control, export restrictions and relevant current licences.",
        "Obtain Ukrainian and other competent authority approvals where required; avoid granting one body another's powers.",
        "No adverse finding against individual persons, intentional financing allegation, or assumption of Russian/DPRK/Iranian participation is made by this research link.",
        "This stage cannot be implemented without a new independently authorized and verified agreement or legal resolution; no sanctions relief or shared finance is implied."
      ],
      "stopCondition": "STOP if transaction authorization, legal ownership, sanctions status, counterparty consent, financing source or civilian safeguards are unresolved; do not execute.",
      "reviewOwner": "Qualified independent counsel and the competent institutional/government authority",
      "asOf": "2026-10-16"
    },
    {
      "id": "bridge-rus-hydrocarbon-energy-trade-transparency",
      "fundingProfileId": "rus-hydrocarbon",
      "regenerativeAlternativeId": "energy-trade-transparency",
      "compatibilityMechanismId": "sanctions-relief",
      "jurisdictionIds": [
        "ru",
        "eu",
        "gb",
        "us",
        "in"
      ],
      "cooperationMode": "reciprocal-conditional",
      "assessment": "research-only-unassessed",
      "premise": "Possible Russian-controlled or sanctioned-counterparty nexus; review separately and do not interpret this option as a consented offer.",
      "legalNexus": "Possible jurisdictions to screen, not a factual finding that their laws all apply. Other countries or instrument-specific frameworks may apply.",
      "requiredChecks": [
        "Identify actual parties, entities, payment routes, goods, locations, and currency before attributing a legal nexus.",
        "Distinguish published funding activity from any future proposal, acceptance, aid diversion, or legal permission.",
        "Independently screen designated persons, ownership/control, export restrictions and relevant current licences.",
        "Obtain Ukrainian and other competent authority approvals where required; avoid granting one body another's powers.",
        "No adverse finding against individual persons, intentional financing allegation, or assumption of Russian/DPRK/Iranian participation is made by this research link.",
        "This stage cannot be implemented without a new independently authorized and verified agreement or legal resolution; no sanctions relief or shared finance is implied."
      ],
      "stopCondition": "STOP if transaction authorization, legal ownership, sanctions status, counterparty consent, financing source or civilian safeguards are unresolved; do not execute.",
      "reviewOwner": "Qualified independent counsel and the competent institutional/government authority",
      "asOf": "2026-10-16"
    },
    {
      "id": "bridge-rus-hydrocarbon-river-basin-repair",
      "fundingProfileId": "rus-hydrocarbon",
      "regenerativeAlternativeId": "river-basin-repair",
      "compatibilityMechanismId": "transboundary-ecology",
      "jurisdictionIds": [
        "ru",
        "eu",
        "gb",
        "us",
        "in"
      ],
      "cooperationMode": "post-agreement",
      "assessment": "research-only-unassessed",
      "premise": "Possible Russian-controlled or sanctioned-counterparty nexus; review separately and do not interpret this option as a consented offer.",
      "legalNexus": "Possible jurisdictions to screen, not a factual finding that their laws all apply. Other countries or instrument-specific frameworks may apply.",
      "requiredChecks": [
        "Identify actual parties, entities, payment routes, goods, locations, and currency before attributing a legal nexus.",
        "Distinguish published funding activity from any future proposal, acceptance, aid diversion, or legal permission.",
        "Independently screen designated persons, ownership/control, export restrictions and relevant current licences.",
        "Obtain Ukrainian and other competent authority approvals where required; avoid granting one body another's powers.",
        "No adverse finding against individual persons, intentional financing allegation, or assumption of Russian/DPRK/Iranian participation is made by this research link.",
        "This stage cannot be implemented without a new independently authorized and verified agreement or legal resolution; no sanctions relief or shared finance is implied."
      ],
      "stopCondition": "STOP if transaction authorization, legal ownership, sanctions status, counterparty consent, financing source or civilian safeguards are unresolved; do not execute.",
      "reviewOwner": "Qualified independent counsel and the competent institutional/government authority",
      "asOf": "2026-10-16"
    },
    {
      "id": "bridge-rus-military-industry-demobilization-retraining",
      "fundingProfileId": "rus-military-industry",
      "regenerativeAlternativeId": "demobilization-retraining",
      "compatibilityMechanismId": "civilian-industrial-conversion",
      "jurisdictionIds": [
        "ru",
        "ua",
        "eu",
        "us",
        "gb"
      ],
      "cooperationMode": "post-agreement",
      "assessment": "research-only-unassessed",
      "premise": "Possible Russian-controlled or sanctioned-counterparty nexus; review separately and do not interpret this option as a consented offer.",